{
  "policy_pack_id": "cA-full",
  "policy_pack_version": "1.0",
  "schema_version": "1.0",
  "description": "Full policy pack with broader limits while preserving safety checks.",
  "limits": {
    "max_files": 12,
    "max_patches": 12,
    "max_content_bytes": 12000,
    "max_total_bytes": 24000
  },
  "toggles": {
    "enforce_todo_check": false,
    "enforce_python_syntax": true
  }
}
